{
  "schedule_schema_id": "edge-imci-holistic-teacher-bakeoff-schedule-v1",
  "generation_run_id": "holistic-teacher-middle-regression-gpt41-20250414-v1",
  "experiment_id": "holistic-teacher-prompt-bakeoff-v1",
  "created_at": "2026-08-23T07:30:31Z",
  "authorization": {
    "project_owner": "Niniola Adegboyega",
    "approved_at": "2026-08-23T07:30:31Z",
    "variant_contract_approved": true,
    "remote_calls_authorized": true,
    "budget": {
      "currency": "USD",
      "maximum_amount": 0.25
    }
  },
  "source_pins": {
    "semantic_cases_sha256": "9026186ea67aea26981985e02b88c503e18a098cca564db33b7ed4313808665f",
    "frozen_language_renderings_sha256": "9b9c1b67a73c2e5763f5507bc55e618d28149bdee6c7c4329ecc8a868e3860a0",
    "variant_contract_sha256": "e21b629670ac321e3f6858559ffa35df19819a782fcf7deb1a871ec919b3f3f0",
    "validator_sha256": "93686513d4fd999784513eb13ad613335f290d8f9393112c3185840e5db980d7",
    "attempt_schema_sha256": "4781a5f7c62381b1deb8e3cf68c16a0ce70aa0158ed4a0f4d8d9fa544acd7759",
    "review_schema_sha256": "4769f85df373e794645399af14e0bbcd5a8d557ddd96c46a2a976991f8ec35b2",
    "selection_policy_sha256": "de3e70434242c9d3eab641887cf3e9ab3b113b65cb9149b8db1541c479fd46fe",
    "schedule_schema_sha256": "2b38347357dbb3d05c0e92eb78d71d9100a2bc1b5ab0ffe11043516831e61437"
  },
  "retry_policy": {
    "transport_retry_limit": 1,
    "semantic_retry": false,
    "uncertain_request_policy": "RECONCILE_BEFORE_RETRY"
  },
  "configurations": [
    {
      "configuration_id": "azure-gpt41-20250414__natural-complete-prompt-v2-1",
      "teacher_provider": "AZURE_OPENAI",
      "teacher_model": "gpt-4.1",
      "teacher_snapshot": "2025-04-14",
      "strategy_id": "phc-natural-complete-v1",
      "prompt_id": "edge-imci-phc-natural-complete",
      "prompt_version": "2.1.0",
      "prompt_sha256": "9489c11c206067199e17ccd9aa7c3b17d42107afdde95c8b590ed9bc5848b8fc",
      "sampling_config": {
        "temperature": 0.7
      },
      "max_output_tokens": 2000
    }
  ],
  "units": [
    {
      "request_id": "holistic-teacher-middle-regression-gpt41-20250414-v1__azure-gpt41-20250414__natural-complete-prompt-v2-1__hpg-011-resp-age-12-rate-40",
      "configuration_id": "azure-gpt41-20250414__natural-complete-prompt-v2-1",
      "semantic_case_id": "hpg-011-resp-age-12-rate-40",
      "strategy_id": "phc-natural-complete-v1",
      "source_request_sha256": "b331e15fe2e8e058c841618d10ec6d9f894f80e709c8dc08f39f771a41cd0b10",
      "review_item_id": "review-aeafd85f4c20a177069d6fb1"
    },
    {
      "request_id": "holistic-teacher-middle-regression-gpt41-20250414-v1__azure-gpt41-20250414__natural-complete-prompt-v2-1__hpg-041-fever-high-positive",
      "configuration_id": "azure-gpt41-20250414__natural-complete-prompt-v2-1",
      "semantic_case_id": "hpg-041-fever-high-positive",
      "strategy_id": "phc-natural-complete-v1",
      "source_request_sha256": "73fdd8d732722e7e5d9621dc34770f3a33b48ac889cbd0d39ac6b001277fcfaa",
      "review_item_id": "review-8c1cf652184e92b732c7a750"
    },
    {
      "request_id": "holistic-teacher-middle-regression-gpt41-20250414-v1__azure-gpt41-20250414__natural-complete-prompt-v2-1__hpg-014-resp-chest-hiv-positive",
      "configuration_id": "azure-gpt41-20250414__natural-complete-prompt-v2-1",
      "semantic_case_id": "hpg-014-resp-chest-hiv-positive",
      "strategy_id": "phc-natural-complete-v1",
      "source_request_sha256": "5e1dfa1ef6a7b675a2337eacb9a50afe8ed2854aa6cebffedca8fa70f7392961",
      "review_item_id": "review-824d13e89f8f604cd7c4027e"
    },
    {
      "request_id": "holistic-teacher-middle-regression-gpt41-20250414-v1__azure-gpt41-20250414__natural-complete-prompt-v2-1__hpg-062-ear-acute-pain",
      "configuration_id": "azure-gpt41-20250414__natural-complete-prompt-v2-1",
      "semantic_case_id": "hpg-062-ear-acute-pain",
      "strategy_id": "phc-natural-complete-v1",
      "source_request_sha256": "4fec5446d17d66d19de045a62f19b243cf931047ac42d3ee9118039ac92bf056",
      "review_item_id": "review-d4c47dd16e860a13c9eb1e82"
    }
  ]
}
